{
  "schema_version": "1.0.0",
  "task_id": "a1b2c3d4e5f60178",
  "chunk_id": "CPP_PA01_DIM1_001",
  "shard_index": 0,
  "executor_id": "text_mining_executor",
  "success": true,
  "result": {
    "content": "Policy document analysis reveals three key industrial policy mechanisms: (1) targeted subsidies for manufacturing sectors, (2) regulatory incentives for R&D investment, and (3) infrastructure development in strategic zones.",
    "content_hash": "b4c5d6e7f8a9b0c1d2e3f4a5b6c7d8e9f0a1b2c3d4e5f6a7b8c9d0e1f2a3b4c5",
    "pa_code": "PA01",
    "dim_code": "DIM1",
    "metadata": {
      "confidence_score": 0.92,
      "evidence_sources": ["Section 3.2", "Section 4.1", "Annex B"],
      "extraction_method": "semantic_text_mining",
      "language": "es"
    }
  },
  "timestamp": "2025-12-18T20:15:30Z",
  "duration_ms": 1245,
  "provenance": {
    "phase": "phase_2",
    "stage": "execution",
    "seed": 42,
    "config_hash": "a3f2b8c9d1e4f5a6b7c8d9e0f1a2b3c4d5e6f7a8b9c0d1e2f3a4b5c6d7e8f9a0",
    "code_version": "v1.2.3"
  },
  "contracts_verified": [
    {
      "contract_name": "RoutingContract",
      "status": "PASSED",
      "details": "Task correctly routed to TextMiningExecutor"
    },
    {
      "contract_name": "ConcurrencyDeterminism",
      "status": "PASSED",
      "details": "Deterministic execution verified with seed=42"
    },
    {
      "contract_name": "ContextImmutability",
      "status": "PASSED",
      "details": "Context unchanged during execution"
    }
  ]
}
